{
  "title": "PluginRecord",
  "$schema": "https://json-schema.org/draft/2020-12/schema",
  "type": "object",
  "properties": {
    "name": {
      "type": "string",
      "minLength": 1
    },
    "artifact": {
      "type": "string",
      "minLength": 1
    },
    "source": {
      "type": "string",
      "minLength": 1
    },
    "addedAt": {
      "type": "string",
      "minLength": 1
    },
    "tools": {
      "type": "array",
      "items": {
        "type": "object",
        "properties": {
          "name": {
            "type": "string",
            "minLength": 1
          },
          "summary": {
            "type": "string",
            "minLength": 1
          },
          "dangerous": {
            "type": "boolean"
          },
          "parameters": {
            "type": "array",
            "items": {
              "type": "object",
              "properties": {
                "name": {
                  "type": "string",
                  "minLength": 1
                },
                "type": {
                  "type": "string",
                  "enum": [
                    "string",
                    "number",
                    "boolean",
                    "object",
                    "array"
                  ]
                },
                "required": {
                  "type": "boolean"
                },
                "description": {
                  "type": "string",
                  "minLength": 1
                },
                "allowedValues": {
                  "minItems": 1,
                  "type": "array",
                  "items": {
                    "type": "string"
                  }
                }
              },
              "required": [
                "name",
                "type",
                "required",
                "description"
              ],
              "additionalProperties": false
            }
          }
        },
        "required": [
          "name",
          "summary",
          "dangerous",
          "parameters"
        ],
        "additionalProperties": false
      }
    },
    "capabilities": {
      "type": "array",
      "items": {
        "type": "string",
        "minLength": 1
      }
    }
  },
  "required": [
    "name",
    "artifact",
    "source",
    "addedAt",
    "tools",
    "capabilities"
  ],
  "additionalProperties": false
}
